{
  "result": {
    "success": true,
    "summary": "codex exec completed successfully"
  },
  "output_artifacts": [],
  "session_log": "{\"type\":\"thread.started\",\"thread_id\":\"019f3f9a-683f-7d32-b951-325d4628fad0\"}\n{\"type\":\"turn.started\"}\n{\"type\":\"item.completed\",\"item\":{\"id\":\"item_0\",\"type\":\"agent_message\",\"text\":\"CODEX_LANGFUSE_MODEL_OK\"}}\n{\"type\":\"turn.completed\",\"usage\":{\"input_tokens\":16839,\"cached_input_tokens\":9600,\"output_tokens\":11,\"reasoning_output_tokens\":0}}\n\n[stderr]\nReading additional input from stdin...\n",
  "observability": {
    "exporters": [
      {
        "kind": "file",
        "status": "ok",
        "target": "experiments/2026-07-07--langfuse--otel-ingestion-smoke/runs/codex-live-real-langfuse-model-resolved/events.jsonl",
        "events_exported": 6,
        "links": [
          {
            "label": "codex exec events",
            "uri": "experiments/2026-07-07--langfuse--otel-ingestion-smoke/runs/codex-live-real-langfuse-model-resolved/events.jsonl"
          }
        ],
        "error": null
      },
      {
        "kind": "langfuse_otlp",
        "status": "ok",
        "target": "http://localhost:3000/api/public/otel/v1/traces",
        "events_exported": 6,
        "links": [
          {
            "label": "LangFuse trace",
            "uri": "http://localhost:3000/project/agentic-primitives-local-project/traces/edc4d1b77ac6b59a530c5a0014a0707b"
          }
        ],
        "error": null
      }
    ]
  }
}